{
  "spec": "aic/0.1",
  "manifest_version": "0.1.0",
  "generated_at": "2026-03-28T00:00:00.000Z",
  "forbiddenActions": [
    "customer.delete"
  ],
  "riskBands": {
    "low": {
      "requiresConfirmation": false
    },
    "medium": {
      "requiresConfirmation": true
    },
    "high": {
      "requiresConfirmation": true
    },
    "critical": {
      "requiresConfirmation": true
    }
  }
}
